 00:00:00.000000 IP 10.0.2.15.40138 > 3.233.158.26.443: Flags [.], ack 869060504, win 65535, length 0
 00:00:00.000326 IP 3.233.158.26.443 > 10.0.2.15.40138: Flags [.], ack 1, win 65535, length 0
 00:00:10.239545 IP 10.0.2.15.40138 > 3.233.158.26.443: Flags [.], ack 1, win 65535, length 0
 00:00:00.000235 IP 3.233.158.26.443 > 10.0.2.15.40138: Flags [.], ack 1, win 65535, length 0
 00:00:06.709005 IP 10.0.2.15.36746 > 172.64.155.209.443: Flags [P.], seq 3504205112:3504205151, ack 846176978, win 65535, length 39
 00:00:00.000237 IP 172.64.155.209.443 > 10.0.2.15.36746: Flags [.], ack 39, win 65535, length 0
 00:00:00.030894 IP 172.64.155.209.443 > 10.0.2.15.36746: Flags [P.], seq 1:40, ack 39, win 65535, length 39
 00:00:00.000025 IP 10.0.2.15.36746 > 172.64.155.209.443: Flags [.], ack 40, win 65535, length 0
 00:00:03.499912 IP 10.0.2.15.40138 > 3.233.158.26.443: Flags [.], ack 1, win 65535, length 0
 00:00:00.000216 IP 3.233.158.26.443 > 10.0.2.15.40138: Flags [.], ack 1, win 65535, length 0
 00:00:07.724171 IP 34.107.243.93.443 > 10.0.2.15.43664: Flags [P.], seq 764161292:764161316, ack 3158351784, win 65535, length 24
 00:00:00.000177 IP 10.0.2.15.43664 > 34.107.243.93.443: Flags [P.], seq 1:29, ack 24, win 62926, length 28
 00:00:00.004577 IP 34.107.243.93.443 > 10.0.2.15.43664: Flags [.], ack 29, win 65535, length 0
 00:00:02.510806 IP 10.0.2.15.40138 > 3.233.158.26.443: Flags [.], ack 1, win 65535, length 0
 00:00:00.000169 IP 3.233.158.26.443 > 10.0.2.15.40138: Flags [.], ack 1, win 65535, length 0
 00:00:10.239267 IP 10.0.2.15.40138 > 3.233.158.26.443: Flags [.], ack 1, win 65535, length 0
 00:00:00.000217 IP 3.233.158.26.443 > 10.0.2.15.40138: Flags [.], ack 1, win 65535, length 0

